{
  "$schema": "https://json-schema.org/draft/2020-12/schema",
  "$id": "https://TJBot.local/schemas/domain-meta.schema.json",
  "title": "Domain Meta",
  "description": "Per-feature metadata: src/features/<domain>/domain.meta.json. Owned by the lane that owns <domain>.",
  "type": "object",
  "additionalProperties": false,
  "required": ["id", "owner_lane", "flow", "edge_cases"],
  "properties": {
    "id": {
      "type": "string",
      "pattern": "^[a-z][a-z0-9-]*$",
      "description": "Domain id (kebab-case). Must equal the src/features/<id>/ directory name."
    },
    "owner_lane": {
      "type": "string",
      "enum": ["A", "B", "C", "D"],
      "description": "Which lane owns this domain (per docs/flows/AGENTS.md ownership matrix)."
    },
    "flow": {
      "type": "string",
      "description": "Path (repo-relative) to the generated mermaid flow file for this domain.",
      "pattern": "^docs/flows/domains/[a-z][a-z0-9-]*/flow\\.generated\\.mmd$"
    },
    "edge_cases": {
      "type": "object",
      "description": "Map of edge-state-id -> array of edge-case template names that apply.",
      "propertyNames": { "pattern": "^[a-z][a-z0-9_]*$" },
      "additionalProperties": {
        "type": "array",
        "minItems": 1,
        "uniqueItems": true,
        "items": {
          "type": "string",
          "enum": ["error", "retry", "cancel", "timeout", "validation", "unauthorized"]
        }
      }
    }
  }
}
