{
  "id": "parent",
  "owner_lane": "C",
  "flow": "docs/flows/domains/parent/flow.generated.mmd",
  "edge_cases": {
    "parent_gate": ["unauthorized"],
    "parent_locked_out": ["unauthorized", "timeout"],
    "parent_account_privacy": ["unauthorized"],
    "parent_rewards": ["error", "retry", "validation"],
    "parent_settings": ["error", "retry", "validation"]
  }
}
